{"contract_version": "1.0", "audience": "downstream_agent", "operating_windows": [{"id": "OW-001", "factor": "temp", "factor_unit": "C", "response": "y", "range": [500.0, 600.0], "expected_effect": {"delta": 1.0, "direction_semantics": "per unit", "ci95": null, "unit": null}, "confidence": "low", "fdr_q": null, "sample_size": 10, "evidence_refs": [], "extrapolation": false, "confirmation_needed": false}], "current_baseline": {"point": {}}, "response_specs": {}, "confirmations": [], "watchlist": [], "constraints": [], "applicability_domain": {"n_rows": 10, "time_span": null, "regime": null, "factor_observed_ranges": {"temp": {"min": 0.0, "max": 100.0}}}, "invalidation_conditions": [], "usage_rules": [], "provenance": {"input_sha256": "x", "script_version": "1", "seed": null, "authored_by": "script"}}